{
  "form_name": "Example Clinical Screen",
  "table_name": "CustomDocumentExampleClinical",
  "document_name": "Example Clinical Screen",
  "screen_name": "Example Clinical Screen",
  "form_collection_name": "Example Clinical Screen",
  "form_guid": "00000000-0000-0000-0000-000000000001",
  "document_code_guid": "00000000-0000-0000-0000-000000000002",
  "screen_guid": "00000000-0000-0000-0000-000000000003",
  "service_note": "N",
  "requires_signature": "Y",
  "view_document_rdl": "RDLDFACommonReport",
  "stored_procedure": "ssp_GetDFADocumentsData",
  "target_database": "YourSmartCareDatabase",
  "global_code_categories": [
    {
      "category": "XExampleObsLevel",
      "options": [
        { "code_name": "Private room", "external_code1": "PrivateRoom" },
        { "code_name": "Lounge", "external_code1": "LoungeArea" }
      ]
    }
  ],
  "sections": [
    {
      "section_label": "Assessment",
      "section_enable_checkbox": "N",
      "groups": [
        {
          "group_name": "presentation",
          "group_label": "Presentation",
          "number_of_items_in_row": 1,
          "fields": [
            {
              "label": "",
              "column_name": "ChiefComplaint",
              "item_type": 5363
            },
            {
              "label": "Observation level",
              "column_name": "ObservationLevel",
              "item_type": 5365,
              "global_code_category": "XExampleObsLevel",
              "each_radio_button_on_new_line": "Y"
            },
            {
              "label": "Needs follow-up",
              "column_name": "NeedsFollowUp",
              "item_type": 5362
            }
          ]
        }
      ]
    }
  ]
}
